original,translated,reference,context_languages,strategy,bleu
"geo longitude location of where the media has been recorded or produced in degrees according to WGS84 (zero at the prime meridian in Greenwich/UK,  negative values for western longitudes)","Localização geo-longitudinal de onde os meios de comunicação foram gravados ou produzidos em graus de acordo com o WGS84 (zero no meridiano principal em Greenwich/UK, valores negativos para as longitudes ocidentais)",longitude da localização geográfica de onde a mídia foi gravada ou produzida em graus de acordo com WGS84 (zero corresponde ao meridiano de Greenwich/RU e valores negativos a latitudes ao oeste),,NLLB,17.400446794038263
geo location elevation,elevação da localização geográfica,elevação da localização geográfica,,NLLB,100.00000000000004
geo elevation of where the media has been recorded or produced in meters according to WGS84 (zero is average sea level),elevação geográfica de onde os meios de comunicação foram registrados ou produzidos em metros de acordo com o WGS84 (zero é o nível médio do mar),elevação geográfica de onde a mídia foi gravada ou produzida em metros de acordo com WGS84 (zero é a média do nível do mar),,NLLB,34.43833484153614
geo location country,país de localização geográfica,localização geográfica do país,,NLLB,35.35533905932737
country (english name) where the media has been recorded or produced,país (nome em inglês) em que a mídia foi gravada ou produzida,"país, em inglês, onde a mídia foi gravada ou produzida",,NLLB,40.52587697205425
geo location city,localização geográfica cidade,localização geográfica da cidade,,NLLB,45.13864405503391
city (english name) where the media has been recorded or produced,cidade (nome em inglês) onde a mídia foi gravada ou produzida,"cidade, em inglês, onde a mídia foi gravada ou produzida",,NLLB,53.44445934790545
geo location sublocation,Sublocalização de localização geográfica,sublocalização geográfica,,NLLB,15.97357760615681
a location within a city where the media has been produced or created (e.g. the neighborhood),"um local dentro de uma cidade onde os meios de comunicação foram produzidos ou criados (por exemplo, o bairro)",localização numa cidade onde a mídia foi produzida ou criada (ex: bairro),,NLLB,5.406502668979586
geo location horizontal error,Erro horizontal de localização geográfica,desvio horizontal da localização geográfica,,NLLB,23.643540225079395
expected error of the horizontal positioning measures (in meters),Erro esperado das medidas de posicionamento horizontal (em metros),desvio esperado nas medidas de posicionamento horizontal (em metros),,NLLB,69.89307622784945
geo location movement speed,Velocidade de movimento de localização geográfica,velocidade de movimento na localização geográfica,,NLLB,22.957488466614326
movement speed of the capturing device while performing the capture in m/s,Velocidade de movimento do dispositivo de captura durante a realização da captura em m/s,"velocidade de movimento do  dispositivo de captura ao realizar a captura, em m/s",,NLLB,47.92365811426397
geo location movement direction,Geolocalização direção de movimento,direção de movimento na localização geográfica,,NLLB,36.06452879987789
"indicates the movement direction of the device performing the capture of a media. It is represented as degrees in floating point representation, 0 means the geographic north, and increases clockwise","Indica a direção de movimento do dispositivo que realiza a captura de um meio. É representado como graus na representação do ponto flutuante, 0 significa o norte geográfico, e aumenta no sentido horário","indica a direção de movimento do dispositivo ao realizar a captura de uma mídia. É representado como graus em representação fracionária, 0 indica Norte e incrementa-se no sentido do relógio",,NLLB,29.645911587284235
geo location capture direction,Direção de captura de localização geográfica,direção de captura na localização geográfica,,NLLB,22.957488466614326
"indicates the direction the device is pointing to when capturing  a media. It is represented as degrees in floating point  representation, 0 means the geographic north, and increases clockwise","Indica a direção para a qual o dispositivo está apontando ao capturar uma mídia. É representado como graus na representação do ponto flutuante, 0 significa o norte geográfico, e aumenta no sentido horário","indica a direção que o dispositivo estava apontando quando capturava uma mídia. É representado como graus em representação fracionária, 0 indica Norte e incrementa-se no sentido do relógio",,NLLB,22.769581510236414
show name,Nome da exposição,nome do programa,,NLLB,0.0
Name of the tv/podcast/series show the media is from,Nome da TV/podcast/série mostra a mídia é de,"Nome do programa de TV, do podcast ou da série de onde a mídia tem origem",,NLLB,6.314512913091053
show sortname,mostrar nome de classificação,programa para ordenação,,NLLB,0.0
"Name of the tv/podcast/series show the media is from, for sorting purposes","Nome da televisão/podcast/série que mostra a origem dos meios de comunicação social, para efeitos de triagem","Nome do programa de TV, do podcast ou da série de onde a mídia tem origem, para ordenação",,NLLB,5.431360807863857
episode number,Número do episódio,número do episódio,,NLLB,55.03212081491043
The episode number in the season the media is part of,O número de episódios na temporada que os meios de comunicação fazem parte de,O número do episódio da temporada que a mídia faz parte,,NLLB,8.493098745313143
season number,Número de estação,número da temporada,,NLLB,0.0
The season number of the show the media is part of,O número de estação do programa a mídia faz parte de,O número da temporada da série que a mídia faz parte,,NLLB,27.901593935858266
lyrics,letra da canção,letras de música,,NLLB,0.0
"The lyrics of the media, commonly used for songs","As letras dos meios de comunicação, comumente usadas para canções","As letras de música da mídia, normalmente para músicas",,NLLB,9.425159511373677
composer sortname,nome do compositor,compositor para ordenação,,NLLB,27.516060407455225
"person(s) who composed the recording, for sorting purposes","Pessoas ((s) que compuseram a gravação, para fins de classificação","pessoa(s) que compôs(useram) a gravação, para ordenação",,NLLB,36.61926362999428
grouping,agrupamento,parte,,NLLB,0.0
"Groups related media that spans multiple tracks, like the different pieces of a concerto. It is a higher level than a track, but lower than an album","Grupos relacionados com mídia que abrange várias faixas, como as diferentes peças de um concerto. É um nível mais alto do que uma faixa, mas menor do que um álbum","Partes da mídia que se estende em várias faixas, como diferentes partes de um concerto. Tem um nível acima da faixa, mas abaixo do álbum",,NLLB,20.69099661161138
user rating,Classificação do utilizador,avaliação do usuário,,NLLB,27.516060407455225
"Rating attributed by a user. The higher the rank, the more the user likes this media","Rating atribuído por um usuário. Quanto maior a classificação, mais o usuário gosta desta mídia","Avaliação atribuída pelo usuário. Quanto melhor a avaliação, mais o usuário gosta da mídia",,NLLB,30.277029197532105
device manufacturer,fabricante do dispositivo,fabricante do dispositivo,,NLLB,100.00000000000004
Manufacturer of the device used to create this media,Fabricante do dispositivo utilizado para a criação desta mídia,Fabricante do dispositivo utilizado para criar esta mídia,,NLLB,46.713797772820016
device model,Modelo de dispositivo,modelo do dispositivo,,NLLB,27.516060407455225
Model of the device used to create this media,Modelo do dispositivo utilizado para criar esta mídia,Modelo do dispositivo utilizado para criar esta mídia,,NLLB,100.00000000000004
application name,Nome da aplicação,nome do aplicativo,,NLLB,0.0
Application used to create the media,Aplicação utilizada para criar a mídia,Aplicativo utilizado para criar a mídia,,NLLB,50.81327481546147
application data,Dados de aplicação,dados do aplicativo,,NLLB,0.0
Arbitrary application data to be serialized into the media,Dados arbitrários de aplicação a ser serializados nos meios de comunicação social,Dados arbitrários do aplicativo para ser serializado na mídia,,NLLB,7.495553473355842
image orientation,Orientação da imagem,orientação de imagem,,NLLB,27.516060407455225
How the image should be rotated or flipped before display,Como a imagem deve ser girada ou virada antes de ser exibida,Como a imagem deveria ser rotacionada ou invertida antes da exibição,,NLLB,14.991106946711685
publisher,editora,editora,,NLLB,100.00000000000004
Name of the label or publisher,Nome do rótulo ou da editora,Nome da gravadora ou editora,,NLLB,11.478744233307168
interpreted-by,Interpretado por,interpretado-por,,NLLB,0.0
Information about the people behind a remix and similar interpretations,Informações sobre as pessoas por trás de um remix e interpretações semelhantes,Informações sobre a pessoa detrás de um remix ou interpretações similares,,NLLB,16.59038701421972
midi-base-note,Nota de base midi,nota-base-midi,,NLLB,0.0
Midi note number of the audio track.,Número da nota midi da faixa de áudio.,Número MIDI da nota da trilha de áudio.,,NLLB,24.274588585366175
private-data,dados privados,dados-privados,,NLLB,0.0
Private data,Dados privados,Dados privados,,NLLB,100.00000000000004
", ","- Não , não .",", ",,NLLB,10.682175159905853
No URI handler for the %s protocol found,Nenhum processador URI para o protocolo %s encontrado,Nenhum manipulador URI para o protocolo %s foi encontrado,,NLLB,56.481980977130846
URI scheme '%s' not supported,Sistema de URI '%s' não suportado,"Não há suporte para o esquema URI ""%s""",,NLLB,4.513617516969122
"ERROR: from element %s: %s
",ERROR: do elemento %s: %s,"ERRO: do elemento %s: %s
",,NLLB,86.33400213704509
"Additional debug info:
%s
","Informações adicionais de depuração:
%s","Informação adicional de depuração:
%s
",,NLLB,61.47881529512643
link has no source [sink=%s@%p],link não tem fonte [sink=%s@%p],não há elemento fonte no link [sink=%s@%p],,NLLB,59.69476877317256
link has no sink [source=%s@%p],link não tem sink [source=%s@%p],não há consumidor no link [source=%s@%p],,NLLB,63.0806851723783
"no property ""%s"" in element ""%s""","Nenhuma propriedade ""%s"" no elemento ""%s""","nenhuma propriedade ""%s"" no elemento ""%s""",,NLLB,90.36020036098445
"Element ""%s"" is not a GstPreset","O elemento ""%s"" não é um GstPreset","O elemento ""%s"" não é um GstPreset",,NLLB,100.00000000000004
"could not set preset ""%s"" in element ""%s""","Não pôde definir ""%s"" no elemento ""%s""","não foi possível definir o valor ""%s"" no elemento ""%s""",,NLLB,59.85558517362037
"no element ""%s""","Nenhum elemento ""%s""","nenhum elemento ""%s""",,NLLB,75.98356856515926
"could not set property ""%s"" in element ""%s"" to ""%s""","Não pôde definir a propriedade ""%s"" no elemento ""%s"" para ""%s""","não foi possível definir a propriedade ""%s"" no elemento ""%s"" para o valor ""%s""",,NLLB,69.12816270438648
"could not set property ""%s"" in child of element ""%s"" to ""%s""","Não pôde definir a propriedade ""%s"" em filho do elemento ""%s"" para ""%s""","não foi possível definir a propriedade ""%s"" no filho do elemento ""%s"" para o valor ""%s""",,NLLB,60.10019292721157
Delayed linking failed.,A ligação atrasada falhou.,Falha no vínculo postergado.,,NLLB,10.682175159905853
"could not link %s to %s, %s can't handle caps %s","Não conseguiu vincular %s a %s, %s não pode lidar com caps %s","não foi possível vincular %s em %s, %s não consegue manipular Caps %s",,NLLB,36.6151076865785
"could not link %s to %s, neither element can handle caps %s","Não conseguiu vincular %s a %s, nenhum elemento pode lidar com os limites %s","não foi possível vincular %s em %s, nenhum elemento consegue manipular Caps %s",,NLLB,29.550432371218744
could not link %s to %s with caps %s,Não conseguiu vincular %s a %s com caps %s,não foi possível vincular %s em %s com Caps %s,,NLLB,22.162547573048695
could not link %s to %s,Não conseguiu vincular %s a %s,não foi possível vincular %s em %s,,NLLB,22.811360354329615
"unexpected reference ""%s"" - ignoring","referência inesperada ""%s"" - ignorando","referência inesperada ""%s"" - ignorando",,NLLB,100.00000000000004
"unexpected pad-reference ""%s"" - ignoring","pad-referência inesperada ""%s"" - ignorando","referência ao Pad inesperada ""%s"" - ignorando",,NLLB,65.48907866815301
"could not parse caps ""%s""","Não conseguiu analisar os caps ""%s""","não foi possível analisar o Caps ""%s""",,NLLB,28.240990488565412
"no sink element for URI ""%s""","Não há elemento sink para URI ""%s""","nenhum elemento consumidor para o URI ""%s""",,NLLB,42.7287006396234
"no source element for URI ""%s""","Nenhum elemento fonte para URI ""%s""","nenhum elemento fonte para o URI ""%s""",,NLLB,53.417359568998464
syntax error,Erro de sintaxe,erro de sintaxe,,NLLB,55.03212081491043
"specified empty bin ""%s"", not allowed","especificado bin vazio ""%s"", não permitido","o Bin ""%s"" está vazio, operação não permitida",,NLLB,24.736929544091932
"no bin ""%s"", unpacking elements","Nenhum bin ""%s"", elementos de desempacotamento","nenhum Bin ""%s"", descarregando elementos",,NLLB,41.11336169005198
empty pipeline not allowed,tubo vazio não permitido,não é permitido que a fila de processamento seja vazia,,NLLB,4.238556455648295
A lot of buffers are being dropped.,Estão a ser lançados muitos tampões.,Uma grande quantidade de buffers está sendo descartada.,,NLLB,4.935157841536379
Internal data flow problem.,Problemas internos de fluxo de dados.,Problema interno no fluxo de dados.,,NLLB,41.11336169005198
Internal data flow error.,Erro de fluxo de dados interno.,Erro interno no fluxo de dados.,,NLLB,29.071536848410968
Internal clock error.,Erro do relógio interno.,Erro interno no temporizador.,,NLLB,14.058533129758727
Failed to map buffer.,Não conseguiu mapear o buffer.,Falha ao mapear o buffer.,,NLLB,50.81327481546147
Filter caps,Capas de filtro,Filtro Caps,,NLLB,0.0
Restrict the possible allowed capabilities (NULL means ANY). Setting this property takes a reference to the supplied GstCaps object.,Restringir as possibilidades permitidas (NULL significa qualquer coisa). Esta propriedade é definida com referência ao objeto GstCaps fornecido.,Restrinja as possíveis capacidades permitidas (NULL = ANY). Definindo essa propriedade é levada uma referência ao objeto GstCaps fornecido.,,NLLB,30.7799847080594
Caps Change Mode,Mudança de Modo de Caps,Modo de Alteração do Caps,,NLLB,23.643540225079395
Filter caps change behaviour,Capazes de filtragem alteram o comportamento,Comportamento de alteração do filtro Caps,,NLLB,8.116697886877475
No Temp directory specified.,Nenhum diretório Temp especificado.,Nenhum diretório temporário especificado.,,NLLB,30.213753973567677
"Could not create temp file ""%s"".","Não conseguiu criar arquivo temporário ""%s"".","Não foi possível criar o arquivo temporário ""%s"".",,NLLB,55.7043881530108
"Could not open file ""%s"" for reading.","Não consegui abrir o arquivo ""%s"" para leitura.","Não foi possível abrir o arquivo ""%s"" para leitura.",,NLLB,76.04321823471474
Error while writing to download file.,Erro ao escrever para baixar arquivo.,Erro ao escrever no arquivo baixado.,,NLLB,27.77619034011791
No file name specified for writing.,Nenhum nome de arquivo especificado para escrita.,Nenhum nome de arquivo especificado para escrita.,,NLLB,100.00000000000004
"Could not open file ""%s"" for writing.","Não consegui abrir o arquivo ""%s"" para escrita.","Não foi possível abrir o arquivo ""%s"" para escrita.",,NLLB,76.04321823471474
"Error closing file ""%s"".","Erro de fechamento do arquivo ""%s"".","Erro ao fechar o arquivo ""%s"".",,NLLB,53.7284965911771
"Error while seeking in file ""%s"".","Erro ao procurar no arquivo ""%s"".","Erro ao buscar no arquivo ""%s"".",,NLLB,70.71067811865478
"Error while writing to file ""%s"".","Erro ao escrever no arquivo ""%s"".","Erro ao escrever no arquivo ""%s"".",,NLLB,100.00000000000004
No file name specified for reading.,Nenhum nome de ficheiro especificado para leitura.,Nenhum nome de arquivo especificado para leitura.,,NLLB,50.000000000000014
"Could not get info on ""%s"".","Não conseguiu obter informações sobre ""%s"".","Não foi possível obter informações em ""%s"".",,NLLB,42.2683921634124
"""%s"" is a directory.","""%s"" é um diretório.","""%s"" é um diretório.",,NLLB,100.00000000000004
"File ""%s"" is a socket.","O arquivo ""%s"" é um soquete.","O arquivo ""%s"" é um soquete.",,NLLB,100.00000000000004
Failed after iterations as requested.,Falhou após iterações como solicitado.,Falha após as interações requeridas.,,NLLB,9.652434877402245
caps,Capas,Caps,,NLLB,0.0
detected capabilities in stream,Capacidades detectadas no fluxo,capacidades detectadas no fluxo,,NLLB,59.460355750136046
minimum,mínimo,mínimo,,NLLB,100.00000000000004
force caps,Capas de força,forçar Caps,,NLLB,0.0
force caps without doing a typefind,Capas de força sem fazer uma descoberta de tipo,forçar Caps sem usar o typefind,,NLLB,4.767707020457095
Stream doesn't contain enough data.,O fluxo não contém dados suficientes.,O fluxo não contém dados suficientes.,,NLLB,100.00000000000004
Stream contains no data.,O fluxo não contém dados.,O fluxo não contém dados.,,NLLB,100.00000000000004
"%sImplemented Interfaces%s:
",%sInterfaces implementadas%s:,"%sInterfaces implementadas%s:
",,NLLB,100.00000000000004
readable,legível,legível,,NLLB,100.00000000000004
writable,escriturável,gravável,,NLLB,0.0
deprecated,Desfeito,obsoleto,,NLLB,0.0
controllable,controlável,controlável,,NLLB,100.00000000000004
conditionally available,disponível condicionalmente,condicionalmente disponível,,NLLB,70.71067811865478
"changeable in NULL, READY, PAUSED or PLAYING state","Alterável em estado NULL, READY, PAUZED ou PLAYING","estado alterável para NULO, PRONTO, PAUSADO ou REPRODUZINDO",,NLLB,5.934202609760488
"changeable only in NULL, READY or PAUSED state","apenas modificável em estado NULL, READY ou PAUZED","estado alterável apenas para NULO, PRONTO ou PAUSADO",,NLLB,6.742555929751843
changeable only in NULL or READY state,apenas modificável no estado NULL ou READY,estado alterável apenas para NULO ou PRONTO,,NLLB,8.643019616048525
Blacklisted files:,Arquivos incluídos na lista negra:,Arquivos colocados na lista negra:,,NLLB,53.7284965911771
%sTotal count%s: %s,%s Contagem total de %s: %s,%sContagem total%s: %s,,NLLB,42.7287006396234
Print all elements,Imprimir todos os elementos,Exibir todos elementos,,NLLB,18.99589214128981
Print list of blacklisted files,Imprimir lista de arquivos incluídos na lista negra,Exibir lista dos arquivos na lista negra,,NLLB,23.356898886410004
"Print a machine-parsable list of features the specified plugin or all plugins provide.
                                       Useful in connection with external automatic plugin installation mechanisms","Imprima uma lista de recursos que podem ser analisados por máquina pelo plug-in especificado ou todos os plug-ins fornecidos.
Útil em conexão com mecanismos externos de instalação automática de plugins","Exibir uma lista, legível para máquina, de recursos que o plug-in especificado ou todos os plug-ins fornecem.
                                       Útil na conexão com mecanismos externos de instalação automática de plug-ins",,NLLB,45.00353093570273
List the plugin contents,Lista dos conteúdos do plugin,Listar o conteúdo do plugin,,NLLB,21.3643503198117
A slashes ('/') separated list of types of elements (also known as klass) to list. (unordered),Uma lista separada de tipos de elementos (também conhecida como klass) para a lista. (não ordenada),"Uma lista de tipos de elementos separados por barras, ""/"", (também conhecidos como klass) para lista (não-ordenada).",,NLLB,22.900907468207997
Check if the specified element or plugin exists,Verifique se o elemento ou plugin especificado existe,Verificar se o elemento ou plug-in especificado existe,,NLLB,41.11336169005198
"When checking if an element or plugin exists, also check that its version is at least the version specified","Ao verificar se um elemento ou plugin existe, verifique também se sua versão é pelo menos a versão especificada","Ao verificar se um elemento ou plug-in existe, também verificar se a versão é no mínimo a especificada",,NLLB,32.788651923723414
"Print supported URI schemes, with the elements that implement them","Imprimir esquemas URI suportados, com os elementos que os implementam","Exibir esquemas URI com suporte, com os elementos que os implementam",,NLLB,57.66735394403278
"Could not load plugin file: %s
",Não conseguiu carregar o arquivo do plugin: %s,"Não foi possível carregar o arquivo do plug-in: %s
",,NLLB,35.5433394487517
"No such element or plugin '%s'
",Nenhum elemento ou plug-in '%s',"Nenhum elemento ou plug-in ""%s""
",,NLLB,37.68499164492418
Index statistics,Estatísticas do índice,Tabela de estatísticas,,NLLB,0.0
"Setting pipeline to PLAYING ...
",Colocando o canal para jogar ...,"Definindo a fila de processamento para REPRODUZINDO...
",,NLLB,17.20339087300932
"ERROR: pipeline doesn't want to play.
",O oleoduto não quer jogar.,"ERRO: a fila de processamento não quer reproduzir.
",,NLLB,9.22364410103253
"Got message #%u from element ""%s"" (%s): ","Recebi mensagem #%u do elemento ""%s"" (%s):","Obtida a mensagem #%u do elemento ""%s"" (%s): ",,NLLB,87.42223609582064
"Got message #%u from pad ""%s:%s"" (%s): ","Recebi mensagem #%u do pad ""%s:%s"" (%s):","Obtida a mensagem #%u do Pad ""%s:%s"" (%s): ",,NLLB,75.06935728875011
"Got message #%u from object ""%s"" (%s): ","Recebi mensagem #%u do objeto ""%s"" (%s):","Obtida a mensagem #%u do objeto ""%s"" (%s): ",,NLLB,87.42223609582064
Got message #%u (%s):,Recebi mensagem #%u (%s):,Obtida a mensagem #%u (%s):,,NLLB,79.6358031503278
"Got EOS from element ""%s"".
","Recebi EOS do elemento ""%s"".","Obtido o final do fluxo do elemento ""%s"".
",,NLLB,52.01870634468553
"EOS received - stopping pipeline...
",O EOS recebeu a interrupção do gasoduto...,"Final do fluxo encontrado - parando a fila de processamento...
",,NLLB,13.147601201284163
"FOUND TAG      : found by element ""%s"".
","FOUND TAG: encontrado por elemento ""%s"".","ETIQ. ENCONTR. : encontrada pelo elemento ""%s"".
",,NLLB,40.00998551310186
"FOUND TAG      : found by pad ""%s:%s"".
","FOUND TAG: encontrado por pad ""%s:%s"".","ETIQ. ENCONTR. : encontrada pelo Pad ""%s:%s"".
",,NLLB,45.91050315190768
"FOUND TAG      : found by object ""%s"".
","FOUND TAG: encontrado por objeto ""%s"".","ETIQ. ENCONTR. : encontrada pelo objeto ""%s"".
",,NLLB,40.00998551310186
"FOUND TAG
",TAG DE FUNDAÇÃO,"ETIQUETA ENCONTRADA
",,NLLB,0.0
"FOUND TOC      : found by element ""%s"".
","FOUND TOC: encontrado por elemento ""%s"".","TOC ENCONTR.   : encontrada pelo elemento ""%s"".
",,NLLB,45.30516301576311
"FOUND TOC      : found by object ""%s"".
","FOUND TOC: encontrado por objeto ""%s"".","TOC ENCONTR.   : encontrada pelo objeto ""%s"".
",,NLLB,45.30516301576311
"FOUND TOC
",FUND TOC,"TOC ENCONTRADA
",,NLLB,49.99999999999999
"INFO:
%s
","Informações:
%s","INFORMAÇÃO:
%s
",,NLLB,59.460355750136046
"WARNING: from element %s: %s
",AVISO: do elemento %s: %s,"AVISO: do elemento %s: %s
",,NLLB,100.00000000000004
"Pipeline is PREROLLED ...
",O oleoduto está PREROLLED ...,"A fila de processamento foi PREPARADA...
",,NLLB,18.370727471078336
"Prerolled, waiting for buffering to finish...
","Preenrolado, à espera que o tampão termine...","Preparado, esperando o preenchimento do buffer para finalizar...
",,NLLB,14.473710747837549
"Prerolled, waiting for progress to finish...
","Pré-inscrito, à espera que o progresso termine...","Preparado, esperando o progresso para finalizar...
",,NLLB,18.36028134946796
buffering...,O buffering...,preenchendo buffer...,,NLLB,39.76353643835254
"Done buffering, setting pipeline to PLAYING ...
","Já fizemos o amortecedor, colocamos o pipeline para Jogar...","Preenchimento do buffer completo, definindo a fila de processamento para REPRODUZIR...
",,NLLB,11.202079346313559
"Buffering, setting pipeline to PAUSED ...
","Buffering, fixação do gasoduto para PAUSED...","Preenchendo buffer, definindo a fila de processamento para PAUSADO...
",,NLLB,13.147601201284163
"Redistribute latency...
",Redistribuir a latência...,"Redistribuição de latência...
",,NLLB,50.81327481546147
"Setting state to %s as requested by %s...
",Definição do estado para %s conforme solicitado por %s...,"Definindo estado de %s como requerido por %s...
",,NLLB,40.52587697205425
"Interrupt: Stopping pipeline ...
",Interrupção: paragem do oleoduto ...,"Interrupção: Parando a fila de processamento...
",,NLLB,20.130954856436926
"Interrupt while waiting for EOS - stopping pipeline...
",Interromper enquanto aguarda o EOS - parar o oleoduto...,"Interrupção recebida enquanto a finalização do fluxo estava sendo aguardada - parando a fila de processamento...
",,NLLB,7.992818352268786
"EOS on shutdown enabled -- Forcing EOS on the pipeline
",EOS em desligamento habilitado - Forçando EOS no oleoduto,"Finalizar fluxo ao sair habilitado -- Forçando finalização do fluxo na fila de processamento
",,NLLB,3.2530620447891696
"Waiting for EOS...
",À espera da EOS...,"Esperando pelo final do fluxo...
",,NLLB,21.191828141393902
