original,translated,reference,context_languages,strategy,bleu
(dir),(dir),(dir),,NLLB,100.00000000000004
(parent dir),(parente dir),(dir acima),,NLLB,21.02241038134286
(huge),(grande),gigante,,NLLB,0.0
Search Wrapped,Busca encerrada,Pesquisa recomeçou,,NLLB,0.0
This is the only occurrence,Esta é a única ocorrência.,Esta é a única ocorrência,,NLLB,75.98356856515926
Search,Pesquisa,Pesquisa,,NLLB,100.00000000000004
[Backwards],"Não, não, não, não.",[Retroceder],,NLLB,0.0
Cancelled,Cancelação,Cancelado,,NLLB,0.0
No current search pattern,Nenhum padrão de pesquisa atual,Nenhum padrão de pesquisa atualmente,,NLLB,66.87403049764218
Cannot open directory: %s,Não pode abrir o diretório: %s,Não foi possível abrir o diretório: %s,,NLLB,62.401954419369176
Go To Directory,Vai ao diretório,Ir para o diretório,,NLLB,19.716118825581447
Can't go outside of %s,Não pode sair de %s,Não é possível sair de %s,,NLLB,45.48019047027906
Can't move up a directory,Não consigo subir um diretório.,Não é possível subir um diretório,,NLLB,32.46679154750989
Error reading %s: %s,Erro de leitura %s: %s,Erro ao ler %s: %s,,NLLB,54.10822690539397
The working directory has disappeared,O diretório de trabalho desapareceu.,O diretório de trabalho desapareceu,,NLLB,75.98356856515926
Unknown syntax name: %s,Nome de sintaxe desconhecido: %s,Nome de sintaxe desconhecido: %s,,NLLB,100.00000000000004
magic_load() failed: %s,magic_load() falhou: %s,magic_load() falhou: %s,,NLLB,100.00000000000004
magic_file(%s) failed: %s,magic_file(%s) falhou: %s,magic_file(%s) falhou: %s,,NLLB,100.00000000000004
Nothing was cut,Nada foi cortado.,Nada foi cortado,,NLLB,59.460355750136046
Copied nothing,Não copiou nada.,Nada foi copiado,,NLLB,0.0
Cutbuffer is empty,O cutbuffer está vazio.,buffer-de-transferência está vazio,,NLLB,21.3643503198117
Error deleting lock file %s: %s,Erro na exclusão do arquivo de bloqueio %s: %s,Erro ao excluir o arquivo de trava %s: %s,,NLLB,37.7006380454947
Couldn't determine my identity for lock file,Não consegui determinar a minha identidade para o ficheiro de fechamento.,Falha ao determinar minha ID para arquivo de trava,,NLLB,4.789232204309912
Couldn't determine hostname: %s,Não conseguiu determinar o nome do host: %s,Falha ao determinar nome de máquina: %s,,NLLB,17.747405280050266
Error writing lock file %s: %s,Erro de escrita de arquivo de bloqueio %s: %s,Erro ao escrever o arquivo de trava %s: %s,,NLLB,37.7006380454947
Someone else is also editing this file,Outro também está a editar este arquivo.,Outra pessoa também está editando esse arquivo,,NLLB,12.223075560872525
Error opening lock file %s: %s,Erro de abertura de arquivo de bloqueio %s: %s,Erro ao abrir o arquivo de trava %s: %s,,NLLB,37.7006380454947
Bad lock file is ignored: %s,Falso arquivo de bloqueio ignorado: %s,Arquivo de trava inválido é ignorado: %s,,NLLB,32.260135189272866
"File %s is being edited by %s (with %s, PID %s); open anyway?","O arquivo %s está sendo editado por %s (com %s, PID %s); aberto de qualquer forma?","Arquivo %s sendo editado (por %s com %s, PID %s). Abrir mesmo assim?",,NLLB,38.3179239302005
Directory '%s' does not exist,O diretório '%s' não existe,"O diretório ""%s"" não existe",,NLLB,17.026116978186877
Path '%s': %s,Caminho '%s': %s,"Caminho ""%s"": %s",,NLLB,24.0785655451027
Path '%s' is not a directory,Caminho '%s' não é um diretório,"O caminho ""%s"" não é um diretório",,NLLB,28.46946938149361
Path '%s' is not accessible,Caminho '%s' não é acessível,"O caminho ""%s"" não é acessível",,NLLB,19.740631366145518
Directory '%s' is not writable,O diretório '%s' não pode ser escrito,"O diretório ""%s"" não é gravável",,NLLB,11.339582221952005
Can't read file from outside of %s,Não pode ler arquivo de fora de %s,Não foi possível ler arquivo de fora de %s,,NLLB,67.16877364745231
"""%s"" is a directory","""%s"" é um diretório","""%s"" é um diretório",,NLLB,100.00000000000004
"""%s"" is a device file","""%s"" é um arquivo de dispositivo","""%s"" é um arquivo dispositivo",,NLLB,75.06238537503395
"""%s"" is a FIFO","""%s"" é um FIFO","""%s"" é um FIFO",,NLLB,100.00000000000004
%s is meant to be read-only,%s é destinado a ser apenas para leitura,%s tem a intenção de ser somente leitura,,NLLB,11.99014838091355
New Buffer,Novo Buffer,Novo buffer,,NLLB,49.99999999999999
DOS,DOS,DOS,,NLLB,100.00000000000004
Mac,Mac,Mac,,NLLB,100.00000000000004
No more open file buffers,Não há mais buffers de arquivos abertos,Não há mais nenhum buffer de arquivos abertos,,NLLB,35.64026463354184
Interrupted,Interrupto,Interrompido,,NLLB,0.0
File '%s' is unwritable,Arquivo '%s' não pode ser escrito,"O arquivo ""%s"" não é gravável",,NLLB,5.795599612995366
New File,Novo arquivo,Novo arquivo,,NLLB,100.00000000000004
"File ""%s"" not found","Arquivo ""%s"" não encontrado","Arquivo ""%s"" não encontrado",,NLLB,100.00000000000004
Reading from FIFO...,Lendo da FIFO...,Lendo de FIFO...,,NLLB,53.7284965911771
Reading...,A ler...,Lendo...,,NLLB,39.76353643835254
Could not create pipe: %s,Não conseguiu criar tubo: %s,Não foi possível criar o pipe: %s,,NLLB,20.873176328735713
Could not fork: %s,Não pôde forjar: %s,Não foi possível bifurcar: %s,,NLLB,27.48254571080018
Executing...,Executar...,Executando...,,NLLB,59.460355750136046
filtering,Filtragem,filtragem,,NLLB,0.0
Failed to open pipe: %s,Não conseguiu abrir o tubo: %s,Falha ao abrir o pipe: %s,,NLLB,25.848657697858535
Error: %s,Erro: %s,Erro: %s,,NLLB,100.00000000000004
Command to execute in new buffer,Comando para executar em novo buffer,Comando para execução no novo buffer,,NLLB,22.957488466614326
Command to execute,Comando para execução,Comando para execução,,NLLB,100.00000000000004
File to read unconverted into new buffer [from %s],Arquivo para leitura não convertido em novo buffer [a partir de %s],Arquivo para ler não convertido no novo buffer [de %s],,NLLB,28.977907494497103
File to read into new buffer [from %s],Arquivo para leitura no novo buffer [a partir de %s],Arquivo para leitura no novo buffer [de %s],,NLLB,67.03420896351791
File to insert unconverted [from %s],Arquivo para inserir não convertido [a partir de %s],Arquivo para inserção não convertido [de %s],,NLLB,34.172334076593074
File to insert [from %s],Arquivo para inserir [a partir de %s],Arquivo para inserção [de %s],,NLLB,32.46679154750989
"Invalid operating directory: %s
",Directório de operação inválido: %s,"Diretório de operação inválido: %s
",,NLLB,80.91067115702207
"Invalid backup directory: %s
",Directório de backup inválido: %s,"Diretório reserva inválido: %s
",,NLLB,41.11336169005198
Making backup...,Fazendo reforços...,Criando arquivo reserva...,,NLLB,32.55563013321615
Too many existing backup files,Há muitos arquivos de backup existentes .,Muitos arquivos reserva existentes,,NLLB,7.809849842300641
Cannot read original file,Não consegue ler o arquivo original,Não é possível ler o arquivo original,,NLLB,45.48019047027906
Cannot make regular backup,Não posso fazer backup regular.,Não é possível criar um arquivo reserva comum,,NLLB,5.815868174415823
Trying again in your home directory,Tentando de novo no seu diretório de casa,Tentando novamente em seu diretório pessoal,,NLLB,12.223075560872525
Cannot make backup,Não consigo fazer backup.,Não foi possível criar o arquivo reserva,,NLLB,7.160476144948854
Cannot make backup; continue and save actual file?,Não pode fazer backup; continuar e salvar o arquivo real?,Não foi possível criar o arquivo reserva; continuar e salvar o arquivo atual?,,NLLB,34.91665073071339
Cannot make backup: %s,Não pode fazer backup: %s,Não foi possível criar o arquivo reserva: %s,,NLLB,17.112717058426785
Can't write outside of %s,Não pode escrever fora de %s,Não foi possível escrever fora de %s,,NLLB,55.780028607687655
Error writing %s: %s,Erro de escrita %s: %s,Erro ao escrever %s: %s,,NLLB,54.10822690539397
Error writing temp file: %s,Erro de redação do arquivo temporário: %s,Erro ao escrever o arquivo temporário: %s,,NLLB,46.713797772820016
Writing to FIFO...,Escrevendo para o FIFO...,Escrevendo para FIFO...,,NLLB,48.892302243490086
Writing...,Escrever...,Escrevendo...,,NLLB,59.460355750136046
Error reading temp file: %s,Arquivo temporário de leitura de erro: %s,Erro ao ler o arquivo temporário: %s,,NLLB,19.070828081828378
File on disk has been truncated!,O arquivo no disco foi truncado!,O arquivo no disco foi truncado!,,NLLB,100.00000000000004
[DOS Format],[Formatação DOS],[Formato DOS],,NLLB,35.35533905932737
[Mac Format],[Formatação Mac],[Formato Mac],,NLLB,35.35533905932737
[Backup],"Não, não, não, não.",[Arq reserva],,NLLB,0.0
Prepend Selection to File,Preparar a seleção para o arquivo,Pré-adicionar seleção para o arquivo,,NLLB,50.81327481546147
Append Selection to File,Adicionar Seleção ao arquivo,Adicionar seleção para o arquivo,,NLLB,14.794015674776452
Write Selection to File,Escrever Seleção para arquivo,Escrever a seleção para o arquivo,,NLLB,12.750736437345598
Prepend to File,Prepare para arquivo,Pré-adicionar para o arquivo,,NLLB,24.840753130578644
Append to File,Adicionar ao arquivo,Adicionar para o arquivo,,NLLB,24.840753130578644
Write to File,Escrever para arquivo,Escrever para o arquivo,,NLLB,45.13864405503391
Too tiny,Muito pequeno.,Pequena demais,,NLLB,0.0
File exists -- cannot overwrite,O arquivo existe - não pode ser reescrito,O arquivo existe -- não é possível sobrescrevê-lo,,NLLB,22.089591134157878
Save file under DIFFERENT NAME?,Salvar o arquivo com NOME DIFERENTE?,Salvar o arquivo com um NOME DIFERENTE?,,NLLB,51.54486831107658
"File ""%s"" exists; OVERWRITE? ","O arquivo ""%s"" existe; OVERWRITE?","Arquivo ""%s"" já existe; SOBRESCREVER? ",,NLLB,32.46679154750989
File on disk has changed,Arquivo no disco mudou,Arquivo no disco foi alterado,,NLLB,46.30777161991026
File was modified since you opened it; continue saving?,O arquivo foi modificado desde que o abriu. Continuar a guardar?,O arquivo foi modificado desde a última vez que você abriu; continuar salvamento?,,NLLB,28.71901769579641
(more),(mais),(mais),,NLLB,100.00000000000004
Exit,Saída,Sair,,NLLB,0.0
Close,Fechado,Fechar,,NLLB,0.0
Cancel the current function,Cancelar a função atual,Cancela a função atual,,NLLB,59.460355750136046
Display this help text,Mostre este texto de ajuda,Exibe este texto de ajuda,,NLLB,66.87403049764218
Close the current buffer / Exit from nano,Fechar o buffer de corrente / Saída do nano,Fecha o buffer atual / Sai do nano,,NLLB,14.25876976452075
Write the current buffer (or the marked region) to disk,Escreva o buffer atual (ou a região marcada) para disco,Escreve o buffer atual (ou a região marcada) no disco,,NLLB,72.92571723872932
Insert another file into current buffer (or into new buffer),Insira outro arquivo no buffer atual (ou no novo buffer),Insere outro arquivo no buffer atual (ou em um novo buffer),,NLLB,58.33510584342541
Search forward for a string or a regular expression,Pesquise em frente para uma cadeia ou uma expressão regular,Procura para frente por um texto ou uma expressão regular,,NLLB,29.071536848410968
Search backward for a string or a regular expression,Pesquise para trás para uma linha ou uma expressão regular,Procura para trás por um texto ou uma expressão regular,,NLLB,31.239399369202552
Cut current line (or marked region) and store it in cutbuffer,Cortar linha corrente (ou região marcada) e armazená-la em cutbuffer,Recorta a linha atual (ou região marcada) e guarda-a no buffer-de-transferência,,NLLB,39.89486553351906
Copy current line (or marked region) and store it in cutbuffer,Copiar linha corrente (ou região marcada) e armazená-la no cutbuffer,Copia a linha atual (ou região marcada) e armazena-a no buffer-de-transferência,,NLLB,41.24914892312113
Paste the contents of cutbuffer at current cursor position,Colocar o conteúdo do cutbuffer na posição do cursor atual,Cola o conteúdo do buffer-de-transferência na posição do cursor,,NLLB,37.99178428257963
Display the position of the cursor,Mostrar a posição do cursor,Mostra a posição do cursor,,NLLB,66.87403049764218
"Invoke the spell checker, if available","Invocar o verificador de ortografia, se disponível","Chama o verificador ortográfico, se disponível",,NLLB,25.848657697858535
Replace a string or a regular expression,Substituir uma cadeia ou uma expressão regular,Substitui um texto ou expressão regular,,NLLB,14.535768424205482
Go to line and column number,Vai ao número de linha e coluna,Vai para linha e coluna número,,NLLB,27.77619034011791
Go to the matching bracket,Vai para o braço de correspondência .,Vai para o fechamento do parênteses/colchetes/chaves,,NLLB,15.925177647011354
Mark text starting from the cursor position,Marque texto a partir da posição do cursor,Marca o texto iniciando na posição do cursor,,NLLB,22.089591134157878
Throw away the current line (or marked region),Largar a linha atual (ou região marcada),Descarta a linha atual (ou região marcada),,NLLB,86.33400213704509
Indent the current line (or marked lines),Indent a linha corrente (ou as linhas marcadas),Recua a linha atual (ou linhas marcadas),,NLLB,22.957488466614326
Unindent the current line (or marked lines),A linha corrente (ou as linhas marcadas),Remove recuo da linha atual (ou linhas marcadas),,NLLB,20.90067144241744
Undo the last operation,Anula a última operação,Desfaz a última operação,,NLLB,59.460355750136046
Redo the last undone operation,Refazer a última operação desfeita,Refaz a última operação desfeita,,NLLB,66.87403049764218
Go back one character,Volte um personagem.,Volta em um caractere,,NLLB,15.97357760615681
Go forward one character,Vai em frente um personagem,Avança em um caractere,,NLLB,12.70331870386537
Go back one word,Volte uma palavra.,Retrocede em uma palavra,,NLLB,31.947155212313625
Go forward one word,Vai em frente uma palavra.,Avança em uma palavra,,NLLB,17.965205598154213
Go to previous line,Vai para a linha anterior,Vai para a anterior linha,,NLLB,45.180100180492246
Go to next line,Vai para a próxima linha .,Vai para a próxima linha,,NLLB,75.98356856515926
Go to beginning of current line,Vai ao começo da linha corrente,Vai para o início da linha atual,,NLLB,15.207218222740094
Go to end of current line,Vai para o fim da linha corrente,Vai para o fim da linha atual,,NLLB,80.91067115702207
Go to previous block of text,Vai para o bloco de texto anterior,Vai para o bloco de texto anterior,,NLLB,100.00000000000004
Go to next block of text,Vai para o próximo bloco de texto,Vai para a próximo bloco de texto,,NLLB,48.892302243490086
Go to beginning of paragraph; then of previous paragraph,"Vai ao início do parágrafo; em seguida, do parágrafo anterior",Vai para o início do parágrafo; depois para o parágrafo anterior,,NLLB,26.20251007173262
Go just beyond end of paragraph; then of next paragraph,"Ir pouco além do fim do parágrafo; em seguida, do próximo parágrafo",Vai para o fim do parágrafo; depois para o próximo parágrafo,,NLLB,21.142141714303076
Go to first row in the viewport,Vai para a primeira fila no mirador .,Vai para a primeira linha na janela de visualização,,NLLB,30.509752160562883
Go to last row in the viewport,Vai para a última fila no mirador .,Vai para a última linha na janela de visualização,,NLLB,30.509752160562883
Center the line where the cursor is,Centrar a linha onde o cursor está,Centraliza a linha onde o cursor está,,NLLB,80.91067115702207
Go one screenful up,Vai um ecrã para cima .,Vai uma tela acima,,NLLB,8.116697886877475
Go one screenful down,Vai um pouco para baixo.,Vai uma tela abaixo,,NLLB,8.116697886877475
Go to the first line of the file,Vai para a primeira linha do arquivo,Vai para a primeira linha do arquivo,,NLLB,100.00000000000004
Go to the last line of the file,Vai para a última linha do arquivo,Vai para a última linha do arquivo,,NLLB,100.00000000000004
Scroll up one line without moving the cursor textually,Rolar para cima uma linha sem mover o cursor textualmente,Rola uma linha acima sem mover o cursor textualmente,,NLLB,45.180100180492246
Scroll down one line without moving the cursor textually,Descolar para baixo uma linha sem mover o cursor textualmente,Rola uma linha abaixo sem mover o cursor textualmente,,NLLB,45.180100180492246
Switch to the previous file buffer,Passe para o buffer de arquivo anterior,Troca para o buffer de arquivo anterior,,NLLB,80.91067115702207
Switch to the next file buffer,Passe para o próximo buffer de arquivo,Troca para o próximo buffer de arquivo,,NLLB,80.91067115702207
Insert the next keystroke verbatim,Insira o próximo teclado literalmente,Insere o próxima combinação de teclas literal,,NLLB,7.160476144948854
Insert a tab at the cursor position (or indent marked lines),Insira uma guia na posição do cursor (ou linhas marcadas em travessão),Insere uma tabulação na posição do cursor (ou recua linhas marcadas),,NLLB,41.60751652217846
Insert a newline at the cursor position,Insira uma linha nova na posição do cursor,Insere quebra de linha na posição do cursor,,NLLB,36.55552228545123
Delete the character under the cursor,Excluir o caráter no cursor,Apaga o caractere sob o cursor,,NLLB,10.40059768900531
Delete the character to the left of the cursor,Eliminar o caráter à esquerda do cursor,Apaga o caractere a esquerda do cursor,,NLLB,26.269098944241588
Delete backward from cursor to word start,Excluir para trás do cursor para o início da palavra,Exclui para trás do cursor até o início da palavra,,NLLB,52.53819788848316
Delete forward from cursor to next word start,Eliminar para a frente do cursor para o próximo começo da palavra,Exclui para frente do cursor até início da próxima palavra,,NLLB,14.991106946711685
Cut from the cursor position to the end of the file,Cortar a partir da posição do cursor para o fim do arquivo,Recorta do cursor até o fim da linha,,NLLB,10.127993013562818
Justify the current paragraph,Justificar o parágrafo em vigor,Justifica o parágrafo atual,,NLLB,21.3643503198117
Justify the entire file,Justificar todo o arquivo,Justifica o arquivo inteiro,,NLLB,31.947155212313625
"Count the number of lines, words, and characters","Conte o número de linhas, palavras e caracteres","Conta o número de linhas, palavras e caracteres",,NLLB,86.33400213704509
Suspend the editor (return to the shell),Suspende o editor (volte ao shell),Suspende o editor (retorna para o shell),,NLLB,36.28241434631104
Refresh (redraw) the current screen,Refrescar (redraw) a tela atual,Atualiza (re-desenha) a tela atual,,NLLB,43.47208719449914
Try and complete the current word,Tente completar a palavra atual,Tenta e completa a palavra atual,,NLLB,32.55563013321615
Comment/uncomment the current line (or marked lines),Comentar/descomentar a linha atual (ou as linhas marcadas),Comenta/descomenta a linha atual (ou linhas marcadas),,NLLB,43.66835442847811
Save file without prompting,Salvar arquivo sem pedir,Salva o arquivo sem perguntar,,NLLB,24.880469496253564
Search next occurrence backward,Procure o próximo acontecimento para trás,Pesquisa a ocorrência anterior,,NLLB,0.0
Search next occurrence forward,Procure o próximo evento para a frente,Pesquisa a próxima ocorrência,,NLLB,6.567274736060395
Start/stop recording a macro,Iniciar/parar a gravação de uma macro,Inicia/para gravação de um macro,,NLLB,13.134549472120788
Run the last recorded macro,Execute a última macro gravada,Executa a última macro gravada,,NLLB,66.87403049764218
Place or remove an anchor at the current line,Colocar ou remover uma âncora na linha corrente,Coloca ou remove uma âncora na linha atual,,NLLB,36.55552228545123
Jump backward to the nearest anchor,Salta para trás para a âncora mais próxima,Pula para a âncora anterior mais próxima,,NLLB,25.848657697858535
Jump forward to the nearest anchor,Salta para a âncora mais próxima,Pula para a próxima âncora mais próxima,,NLLB,32.159351091190125
Toggle the case sensitivity of the search,Desliga a sensibilidade do caso da pesquisa,Ativa sensibilidade de caixa na pesquisa,,NLLB,7.809849842300641
Reverse the direction of the search,Reverte a direcção da busca,Inverte a direção da pesquisa,,NLLB,12.70331870386537
Toggle the use of regular expressions,Desbloquear o uso de expressões regulares,Ativa o uso de expressões regulares,,NLLB,75.98356856515926
Recall the previous search/replace string,Lembre-se da cadeia anterior de busca/substituição,Lembra o último texto de pesquisa/substituição,,NLLB,12.223075560872525
Recall the next search/replace string,Recorde a próxima cadeia de busca/substituição,Lembra o ultimo texto de pesquisa/substituição,,NLLB,12.223075560872525
Toggle the use of DOS format,Desliga o uso do formato DOS,Ativa o uso do formato DOS,,NLLB,75.98356856515926
Toggle the use of Mac format,Desbloquear o uso de formato Mac,Ativa o uso do formato Mac,,NLLB,22.957488466614326
Toggle appending,Desbloquear apêndice,Ativa ajuntamento,,NLLB,0.0
Toggle prepending,Desbloquear prependentes,Ativa pré-adicionamento,,NLLB,0.0
Toggle backing up of the original file,Desbloquear o backup do arquivo original,Ativa cópia de segurança do arquivo original,,NLLB,25.57539057896621
Execute a function or an external command,Executar uma função ou um comando externo,Executa uma função ou um comando externo,,NLLB,80.91067115702207
Pipe the current buffer (or marked region) to the command,Enviar o buffer atual (ou região marcada) para o comando,Pipe no buffer atual (ou a região marcada) para o comando,,NLLB,58.33510584342541
Recall the previous command,Lembra-te do comando anterior .,Lembra o comando anterior,,NLLB,21.3643503198117
Recall the next command,Lembra-te do próximo comando .,Lembra o comando seguinte,,NLLB,10.682175159905853
Do not convert from DOS/Mac format,Não converter a partir do formato DOS/Mac,Não converte do formato DOS/Mac,,NLLB,46.713797772820016
Toggle the use of a new buffer,Desbloquear o uso de um novo buffer,Ativa o uso de um novo buffer,,NLLB,80.91067115702207
Close buffer without saving it,Fechar o tampão sem guardá-lo,Fecha o buffer sem salvá-lo,,NLLB,12.70331870386537
Go to file browser,Vai para o navegador de arquivos,Vai para o navegador de arquivo,,NLLB,75.98356856515926
Exit from the file browser,Saída do navegador de arquivos,Sai do navegador de arquivos,,NLLB,66.87403049764218
Go to the first file in the list,Vai para o primeiro arquivo da lista,Vai para o primeiro arquivo na lista,,NLLB,64.34588841607616
Go to the last file in the list,Vai para o último arquivo da lista,Vai para o último arquivo na lista,,NLLB,64.34588841607616
Go to the previous file in the list,Vai para o arquivo anterior na lista,Vai para o arquivo anterior na lista,,NLLB,100.00000000000004
Go to the next file in the list,Vai para o próximo arquivo na lista,Vai para o próximo arquivo na lista,,NLLB,100.00000000000004
Go to lefthand column,Vai para a coluna esquerda,Vai para a coluna da esquerda,,NLLB,57.89300674674101
Go to righthand column,Vai para a coluna direita,Vai para a coluna da direita,,NLLB,57.89300674674101
Go to first row in this column,Vai para a primeira linha nesta coluna,Vai para a primeira linha nesta coluna,,NLLB,100.00000000000004
Go to last row in this column,Vai para a última fila nesta coluna,Vai para a última linha nesta coluna,,NLLB,48.892302243490086
Search forward for a string,Pesquisar para a frente por uma cadeia,Pesquisa para frente por um texto,,NLLB,14.535768424205482
Search backward for a string,Pesquisar para trás por uma cadeia,Pesquisa para trás por um texto,,NLLB,30.213753973567677
Refresh the file list,Atualizar a lista de arquivos,Atualiza a lista de arquivos,,NLLB,66.87403049764218
Go to directory,Vai para o diretório .,Vai para o diretório,,NLLB,66.87403049764218
"Invoke the linter, if available","Invocar o linter, se disponível","Chama o lintador, se disponível",,NLLB,32.46679154750989
Go to previous linter msg,Vai para o anterior linker msg,Vai para a mensagem anterior do lintador,,NLLB,15.207218222740094
Go to next linter msg,Vai para o próximo linker msg,Vai para a próxima mensagem do lintador,,NLLB,13.74127285540009
Invoke a program to format/arrange/manipulate the buffer,Invocar um programa para formatar/arranjar/manipular o buffer,Chama um programa para formatar/organizar/manipular o buffer,,NLLB,58.77283725105319
Help,Ajuda,Ajuda,,NLLB,100.00000000000004
Cancel,Cancelar,Cancelar,,NLLB,100.00000000000004
Write Out,Escreva,Gravar,,NLLB,0.0
Read File,Leia o arquivo,Ler o arq,,NLLB,27.516060407455225
Justify,Justificar,Justificar,,NLLB,100.00000000000004
Refresh,Refrigeração,Atualizar,,NLLB,0.0
Where Is,Onde está?,Onde está?,,NLLB,100.00000000000004
Replace,Substituição,Substituir,,NLLB,0.0
Cut,Cortar,Recortar,,NLLB,0.0
Paste,Paste,Colar,,NLLB,0.0
Execute,Execução,Executar,,NLLB,0.0
Location,Localização,Local,,NLLB,0.0
Go To Line,Vai para a linha,Ir p/ linha,,NLLB,15.97357760615681
Undo,Desfeito,Desfazer,,NLLB,0.0
Redo,Redo,Refazer,,NLLB,0.0
Set Mark,Sete Marcos,Marcar,,NLLB,0.0
Copy,Cópia,Copiar,,NLLB,0.0
Case Sens,Sentidos dos casos,Dif. MAI/min,,NLLB,0.0
Reg.exp.,Reg. exp.,Exp.Regular,,NLLB,15.97357760615681
Backwards,Para trás,Contrário,,NLLB,0.0
No Replace,Não há substituição,Sem substituição,,NLLB,27.516060407455225
Older,Mais velhos,Mais antigo,,NLLB,49.99999999999999
Newer,Mais recente,Mais novo,,NLLB,49.99999999999999
Go To Dir,Vai para Dir,Ir p/ dir,,NLLB,0.0
Where Was,Onde estava?,Onde estava,,NLLB,55.03212081491043
Previous,Anterior,Anterior,,NLLB,100.00000000000004
Next,Próximo .,Próxima,,NLLB,0.0
